localid,Language,collection,label,description ,definition,status
23,en,uso_suolo,23,pastures,pastures,https://inspire.ec.europa.eu/registry/status/valid
231,en,uso_suolo,231,pastures dense predominantly graminoid grass cover,pastures dense predominantly graminoid grass cover,https://inspire.ec.europa.eu/registry/status/valid
2311,en,uso_suolo,2311,not irrigated grassland,not irrigated grassland,https://inspire.ec.europa.eu/registry/status/valid
2312,en,uso_suolo,2312,irrigated grassland,irrigated grassland,https://inspire.ec.europa.eu/registry/status/valid
24,en,uso_suolo,24,heterogeneous croplands,heterogeneous croplands,https://inspire.ec.europa.eu/registry/status/valid
241,en,uso_suolo,241,annual crops associated with permanent crops,annual crops associated with permanent crops,https://inspire.ec.europa.eu/registry/status/valid
2411,en,uso_suolo,2411,annual crops associated with olive groves and vineyards,annual crops associated with olive groves and vineyards,https://inspire.ec.europa.eu/registry/status/valid
2412,en,uso_suolo,2412,annual crops associated with vineyards,annual crops associated with vineyards,https://inspire.ec.europa.eu/registry/status/valid
2413,en,uso_suolo,2413,annual crops associated with olive groves and,annual crops associated with olive groves and,https://inspire.ec.europa.eu/registry/status/valid
2414,en,uso_suolo,2414,annual crops associated with mixed fruit trees,annual crops associated with mixed fruit trees,https://inspire.ec.europa.eu/registry/status/valid
242,en,uso_suolo,242,complex cultivation juxtaposition of small parcels of diverse annual crops,complex cultivation juxtaposition of small parcels of diverse annual crops,https://inspire.ec.europa.eu/registry/status/valid
243,en,uso_suolo,243,croplands associated with natural spaces,croplands associated with natural spaces,https://inspire.ec.europa.eu/registry/status/valid
244,en,uso_suolo,244,agroforestal area,agroforestal area,https://inspire.ec.europa.eu/registry/status/valid
3,en,uso_suolo,3,forests and seminatural areas,forests and seminatural areas,https://inspire.ec.europa.eu/registry/status/valid
31,en,uso_suolo,31,forests,forests,https://inspire.ec.europa.eu/registry/status/valid
311,en,uso_suolo,311,broad-leaved forests,broad-leaved forests,https://inspire.ec.europa.eu/registry/status/valid
3111,en,uso_suolo,3111,forest of quercus ilex and coark trees,forest of quercus ilex and coark trees,https://inspire.ec.europa.eu/registry/status/valid
3112,en,uso_suolo,3112,forest of caduc leaved quercus,forest of caduc leaved quercus,https://inspire.ec.europa.eu/registry/status/valid
3113,en,uso_suolo,3113,forest of mesophil broad-leaved species,forest of mesophil broad-leaved species,https://inspire.ec.europa.eu/registry/status/valid
3114,en,uso_suolo,3114,chestnut tree forests,chestnut tree forests,https://inspire.ec.europa.eu/registry/status/valid
3115,en,uso_suolo,3115,forest of beech,forest of beech,https://inspire.ec.europa.eu/registry/status/valid
3116,en,uso_suolo,3116,forest of hygrophilous species,forest of hygrophilous species,https://inspire.ec.europa.eu/registry/status/valid
3117,en,uso_suolo,3117,forest of not native broad-leaved species,forest of not native broad-leaved species,https://inspire.ec.europa.eu/registry/status/valid
312,en,uso_suolo,312,conifereous forest vegetation formation composed where coniferous species predominate,conifereous forest vegetation formation composed where coniferous species predominate,https://inspire.ec.europa.eu/registry/status/valid
3121,en,uso_suolo,3121,forest of mediterranean pine trees,forest of mediterranean pine trees,https://inspire.ec.europa.eu/registry/status/valid
3122,en,uso_suolo,3122,forest of montane pine trees and/or oromediterranean pine trees,forest of montane pine trees and/or oromediterranean pine trees,https://inspire.ec.europa.eu/registry/status/valid
3123,en,uso_suolo,3123,forest of white fir and/or red fir tree,forest of white fir and/or red fir tree,https://inspire.ec.europa.eu/registry/status/valid
3124,en,uso_suolo,3124,forest of larch and/or cembrus pine trees,forest of larch and/or cembrus pine trees,https://inspire.ec.europa.eu/registry/status/valid
3125,en,uso_suolo,3125,forest of not native broad-leaved species dominate,forest of not native broad-leaved species dominate,https://inspire.ec.europa.eu/registry/status/valid
313,en,uso_suolo,313,mixed forest vegetation formation composed where broad-leaved and coniferous species co-dominate,mixed forest vegetation formation composed where broad-leaved and coniferous species co-dominate,https://inspire.ec.europa.eu/registry/status/valid
3131,en,uso_suolo,3131,mixed forest vegetation formation composed where broad-leaved species dominate,mixed forest vegetation formation composed where broad-leaved species dominate,https://inspire.ec.europa.eu/registry/status/valid
31311,en,uso_suolo,31311,mixed forest vegetation formation composed where quercus ilex dominate,mixed forest vegetation formation composed where quercus ilex dominate,https://inspire.ec.europa.eu/registry/status/valid
31312,en,uso_suolo,31312,mixed forest vegetation formation composed where qurcus species dominate,mixed forest vegetation formation composed where qurcus species dominate,https://inspire.ec.europa.eu/registry/status/valid
31313,en,uso_suolo,31313,mixed forest vegetation formation composed where mesofile broad-leaved species dominate,mixed forest vegetation formation composed where mesofile broad-leaved species dominate,https://inspire.ec.europa.eu/registry/status/valid
31314,en,uso_suolo,31314,mixed forest vegetation formation composed where chestnut tree dominate,mixed forest vegetation formation composed where chestnut tree dominate,https://inspire.ec.europa.eu/registry/status/valid
31315,en,uso_suolo,31315,mixed forest vegetation formation composed where beech tree dominate,mixed forest vegetation formation composed where beech tree dominate,https://inspire.ec.europa.eu/registry/status/valid
31316,en,uso_suolo,31316,mixed forest vegetation formation composed where not native coniferous species dominate,mixed forest vegetation formation composed where not native coniferous species dominate,https://inspire.ec.europa.eu/registry/status/valid
31317,en,uso_suolo,31317,mixed forest vegetation formation composed where not native broad-leaved species dominate,mixed forest vegetation formation composed where not native broad-leaved species dominate,https://inspire.ec.europa.eu/registry/status/valid
3132,en,uso_suolo,3132,mixed forest vegetation formation composed where coniferous species dominate,mixed forest vegetation formation composed where coniferous species dominate,https://inspire.ec.europa.eu/registry/status/valid
31321,en,uso_suolo,31321,mixed forest vegetation formation composed where mediterranean pine trees dominate,mixed forest vegetation formation composed where mediterranean pine trees dominate,https://inspire.ec.europa.eu/registry/status/valid
31322,en,uso_suolo,31322,mixed forest vegetation formation composed where montane pine trees and/or oromediterranean pine trees dominate,mixed forest vegetation formation composed where montane pine trees and/or oromediterranean pine trees dominate,https://inspire.ec.europa.eu/registry/status/valid
31323,en,uso_suolo,31323,mixed forest vegetation formation composed where white fir and/or red fir tree dominate,mixed forest vegetation formation composed where white fir and/or red fir tree dominate,https://inspire.ec.europa.eu/registry/status/valid
31324,en,uso_suolo,31324,forest where larch and/or cembrus pine trees dominate,forest where larch and/or cembrus pine trees dominate,https://inspire.ec.europa.eu/registry/status/valid
31325,en,uso_suolo,31325,forest where not native coniferous species dominate,forest where not native coniferous species dominate,https://inspire.ec.europa.eu/registry/status/valid
32,en,uso_suolo,32,shrub and/or herbaceous vegetation associations,shrub and/or herbaceous vegetation associations,https://inspire.ec.europa.eu/registry/status/valid
321,en,uso_suolo,321,natural grassland low productivity grassland often situated in areas of rough uneven,natural grassland low productivity grassland often situated in areas of rough uneven,https://inspire.ec.europa.eu/registry/status/valid
322,en,uso_suolo,322,moors and heathland vegetation with low and closed cover dominated by bushes shrubs and herbaceous plants,moors and heathland vegetation with low and closed cover dominated by bushes shrubs and herbaceous plants,https://inspire.ec.europa.eu/registry/status/valid
323,en,uso_suolo,323,sclerophyllous vegetation,sclerophyllous vegetation,https://inspire.ec.europa.eu/registry/status/valid
3231,en,uso_suolo,3231,high bush,high bush,https://inspire.ec.europa.eu/registry/status/valid
3232,en,uso_suolo,3232,low bush,low bush,https://inspire.ec.europa.eu/registry/status/valid
324,en,uso_suolo,324,transitional woodlands/shrub,transitional woodlands/shrub,https://inspire.ec.europa.eu/registry/status/valid
3241,en,uso_suolo,3241,areas with natural colonization,areas with natural colonization,https://inspire.ec.europa.eu/registry/status/valid
3242,en,uso_suolo,3242,areas with artificial colonization,areas with artificial colonization,https://inspire.ec.europa.eu/registry/status/valid
33,en,uso_suolo,33,open spaces with little or no vegetation,open spaces with little or no vegetation,https://inspire.ec.europa.eu/registry/status/valid
331,en,uso_suolo,331,beaches dunes and sand plains,beaches dunes and sand plains,https://inspire.ec.europa.eu/registry/status/valid
332,en,uso_suolo,332,bare rock scree cliffs rocks and outcrops,bare rock scree cliffs rocks and outcrops,https://inspire.ec.europa.eu/registry/status/valid
333,en,uso_suolo,333,sparsely vegetated areas includes steppes tundra and badlands scattered highattitude,sparsely vegetated areas includes steppes tundra and badlands scattered highattitude,https://inspire.ec.europa.eu/registry/status/valid
334,en,uso_suolo,334,burnt areas areas affected by recent fires still mainly black,burnt areas areas affected by recent fires still mainly black,https://inspire.ec.europa.eu/registry/status/valid
3341,en,uso_suolo,3341,forests with burnt areas,forests with burnt areas,https://inspire.ec.europa.eu/registry/status/valid
3342,en,uso_suolo,3342,other seminatural areas with burnt spaces,other seminatural areas with burnt spaces,https://inspire.ec.europa.eu/registry/status/valid
3343,en,uso_suolo,3343,degradated land by other facts,degradated land by other facts,https://inspire.ec.europa.eu/registry/status/valid
335,en,uso_suolo,335,glaciers and perpetual snow,glaciers and perpetual snow,https://inspire.ec.europa.eu/registry/status/valid
4,en,uso_suolo,4,wetlands,wetlands,https://inspire.ec.europa.eu/registry/status/valid
41,en,uso_suolo,41,inland wetlands non-forested areas either partially seasonally or permanently waterlogged,inland wetlands non-forested areas either partially seasonally or permanently waterlogged,https://inspire.ec.europa.eu/registry/status/valid
411,en,uso_suolo,411,inland marshes low-lying land usually flooded in winter and more or less saturated by water all year round,inland marshes low-lying land usually flooded in winter and more or less saturated by water all year round,https://inspire.ec.europa.eu/registry/status/valid
412,en,uso_suolo,412,peatbogs peatland consisting mainly of decomposed moss and vegetable matter may or may not be exploited,peatbogs peatland consisting mainly of decomposed moss and vegetable matter may or may not be exploited,https://inspire.ec.europa.eu/registry/status/valid
42,en,uso_suolo,42,coastal wetlands non-wooded areas either tidally seasonally or permanently waterlogged with brackish or saline water,coastal wetlands non-wooded areas either tidally seasonally or permanently waterlogged with brackish or saline water,https://inspire.ec.europa.eu/registry/status/valid
421,en,uso_suolo,421,salt marshes vegetated low-lying areas above the high-tide line susceptible to flooding by sea water,salt marshes vegetated low-lying areas above the high-tide line susceptible to flooding by sea water,https://inspire.ec.europa.eu/registry/status/valid
422,en,uso_suolo,422,salines salt-pans active or in process of structuring sections of salt marsh exploited for the production of salt by,salines salt-pans active or in process of structuring sections of salt marsh exploited for the production of salt by,https://inspire.ec.europa.eu/registry/status/valid
423,en,uso_suolo,423,intertidal flats generally unvegetated expanses of mud sand or rock lying between high and low water-marks,intertidal flats generally unvegetated expanses of mud sand or rock lying between high and low water-marks,https://inspire.ec.europa.eu/registry/status/valid
